{
  "directory": "specs/",
  "extensions": [
    ".xlsx",
    ".xls"
  ],
  "exclude_directories": [
    "rv/"
  ],
  "exclude_name_prefixes": [
    "~$"
  ],
  "modified_on": {
    "date": "2026-09-11",
    "timezone": "Asia/Tokyo",
    "not_after": "2026-09-11T12:00:00+09:00"
  },
  "limit": 50,
  "purpose": "Select updated specifications from the frozen Run selection"
}
